{
  "schemaVersion": 1,
  "id": "energy",
  "name": "Energie & Versorgung",
  "version": "1.0.0",
  "description": "Zusatzparameter für Energieerzeuger, Netzbetreiber und versorgungsnahe Betreiber mit Fokus auf Netzstabilität, Entstörung und physische Schutzmaßnahmen.",
  "sectorCategory": "Energie",
  "domainWeightAdjustments": {
    "physical": 1.25,
    "operations": 1.2,
    "cyber": 1.2,
    "bcm": 1.15
  },
  "additionalQuestions": [
    {
      "id": "energy_grid_dependency",
      "domainId": "operations",
      "title": "Netz- und Anlagenabhängigkeiten sind transparent",
      "prompt": "Sind Kaskadeneffekte, Vorleistungsabhängigkeiten und Wiederzuschaltlogiken dokumentiert?",
      "guidance": "Zu betrachten sind vorgelagerte Netze, Fernwirktechnik, Leittechnik und Subunternehmer.",
      "recommendation": "Dokumentieren Sie Kaskaden- und Wiederzuschaltlogiken für kritische Anlagen und Netzkopplungen.",
      "weight": 1.3,
      "critical": true,
      "evidenceHint": "Netzabhängigkeitsanalyse, Wiederzuschaltlogik, Betriebsanweisungen",
      "tags": ["Netz", "Kaskade"]
    },
    {
      "id": "energy_substation_protection",
      "domainId": "physical",
      "title": "Kritische Standorte sind gegen Sabotage geschützt",
      "prompt": "Sind kritische Standorte, Umspannwerke oder Schaltanlagen gegen physische Angriffe und Sabotage ausreichend geschützt?",
      "guidance": "Wichtig sind Perimeterschutz, Video, Sensorik, Zufahrtsschutz und Alarmbearbeitung.",
      "recommendation": "Prüfen und stärken Sie physische Schutzmaßnahmen an kritischen Standorten und Zufahrten.",
      "weight": 1.3,
      "critical": true,
      "evidenceHint": "Perimeterschutz, Alarmkonzept, Standortschutzanalyse",
      "tags": ["Sabotage", "Standortschutz"]
    },
    {
      "id": "energy_ot_recovery",
      "domainId": "cyber",
      "title": "Leit- und Fernwirktechnik kann wiederhergestellt werden",
      "prompt": "Sind Backup, Wiederanlauf und Ersatzverfahren für Leitsysteme, Fernwirktechnik und OT dokumentiert und getestet?",
      "guidance": "Auch Lieferantenabhängigkeit, Konfigurationssicherung und Ersatzhardware sind relevant.",
      "recommendation": "Sichern und testen Sie Wiederanlauf- und Ersatzverfahren für Leit- und Fernwirktechnik einschließlich Konfigurationen.",
      "weight": 1.3,
      "critical": true,
      "evidenceHint": "Wiederanlaufkonzept OT, Konfigurationsbackups, Lieferantenkontakte",
      "tags": ["Leittechnik", "Fernwirktechnik"]
    },
    {
      "id": "energy_manual_operations",
      "domainId": "bcm",
      "title": "Manuelle Betriebsverfahren sind vorbereitet",
      "prompt": "Gibt es erprobte manuelle Verfahren für Entstörung, Schalthandlungen oder lokale Intervention?",
      "guidance": "Wichtig sind Personalverfügbarkeit, Sicherheit und dokumentierte Grenzen des Manualbetriebs.",
      "recommendation": "Definieren und üben Sie manuelle Betriebsverfahren für Störungen, Schalthandlungen und lokale Interventionen.",
      "weight": 1.2,
      "evidenceHint": "Manualbetrieb, Schaltanweisungen, Übungsprotokolle",
      "tags": ["Manualbetrieb", "Entstörung"]
    }
  ],
  "kritisExtension": {
    "eligibleSectors": ["Energie"],
    "hints": [
      "Energie gehört zum expliziten KRITIS-Sektor. In diesem Sektor sind physische Resilienz und IT-/OT-Sicherheit eng zu koppeln.",
      "Für Energiebetreiber ist eine gemeinsame Evidenzsicht aus KRITIS-Dachgesetz und BSIG besonders wichtig."
    ],
    "additionalRequirements": []
  }
}
