{
  "schemaVersion": 1,
  "id": "logistics",
  "name": "Logistik & Transport",
  "version": "1.0.0",
  "description": "Zusatzparameter für Transport- und Logistikunternehmen mit Fokus auf Knotenpunkte, Fahrer- und Dispositionsverfügbarkeit sowie Routenrobustheit.",
  "sectorCategory": "Transport und Verkehr",
  "domainWeightAdjustments": {
    "supply": 1.25,
    "operations": 1.2,
    "people": 1.1,
    "bcm": 1.1
  },
  "additionalQuestions": [
    {
      "id": "log_hub_redundancy",
      "domainId": "operations",
      "title": "Kritische Hubs und Umschlagpunkte haben Ausweichoptionen",
      "prompt": "Können kritische Umschlagpunkte, Lager oder Depots bei Ausfall auf Alternativen umgestellt werden?",
      "guidance": "Bewertet werden Ausweichrouten, Partnernetzwerke und operative Umschaltzeiten.",
      "recommendation": "Definieren Sie Ausweichkonzepte für kritische Hubs, Lager und Depots inklusive Umschaltzeiten und Partnernetzwerken.",
      "weight": 1.2,
      "critical": true,
      "evidenceHint": "Ausweichkonzept, Partnerdepots, Umschaltzeiten",
      "tags": [
        "Hub",
        "Redundanz"
      ]
    },
    {
      "id": "log_driver_availability",
      "domainId": "people",
      "title": "Fahrer- und Dispositionsengpässe sind vorbereitet",
      "prompt": "Existieren Maßnahmen für Ausfälle bei Fahrpersonal, Disposition oder Sonderqualifikationen?",
      "guidance": "Wichtig sind Ersatzpools, Qualifikationen und Priorisierung kritischer Touren.",
      "recommendation": "Entwickeln Sie Notfallkonzepte für Fahrpersonal und Disposition einschließlich Priorisierung kritischer Touren.",
      "weight": 1.1,
      "evidenceHint": "Fahrerpool, Qualifikationsmatrix, Tourpriorisierung",
      "tags": [
        "Fahrer",
        "Disposition"
      ]
    },
    {
      "id": "log_route_disruption",
      "domainId": "supply",
      "title": "Routenstörungen sind beherrschbar",
      "prompt": "Sind Grenzschließungen, Streiks, Wetterlagen oder Infrastrukturausfälle in der Routenplanung berücksichtigt?",
      "guidance": "Entscheidend sind Alternativrouten, Partner und Entscheidungsregeln.",
      "recommendation": "Hinterlegen Sie Alternativrouten, Trigger und Eskalationsregeln für Verkehrs- und Infrastrukturausfälle.",
      "weight": 1.2,
      "critical": true,
      "evidenceHint": "Routenmatrix, Eskalationsregeln, Verkehrsmonitoring",
      "tags": [
        "Routen",
        "Störung"
      ]
    },
    {
      "id": "log_customer_priority",
      "domainId": "bcm",
      "title": "Kundenpriorisierung im Störfall ist festgelegt",
      "prompt": "Ist definiert, welche Kunden, Lieferungen oder Services im Störfall vorrangig bedient werden?",
      "guidance": "Nützlich sind Serviceklassen und abgestimmte Notfallvereinbarungen.",
      "recommendation": "Definieren Sie Priorisierungsregeln für Kunden, Güter und Services im Störfall.",
      "weight": 1.0,
      "evidenceHint": "Serviceklassen, Priorisierungsliste, Kundenvereinbarungen",
      "tags": [
        "Kundenpriorisierung",
        "Service"
      ]
    }
  ],
  "kritisExtension": {
    "eligibleSectors": [
      "Transport und Verkehr"
    ],
    "hints": [
      "Transport und Verkehr ist ein ausdrücklicher KRITIS-Sektor. Bei kritischen Knotenpunkten ist die Einstufung früh zu prüfen.",
      "Für Logistikunternehmen sind Kaskadeneffekte entlang von Hubs, Transportwegen und Kundensegmenten besonders relevant."
    ],
    "additionalRequirements": []
  },
  "uiHints": {
    "accentLabel": "Hubs, Routen und Priorisierung",
    "focusAreas": [
      "Ausweichrouten",
      "Hub-Redundanz",
      "Kundenpriorisierung"
    ]
  },
  "recommendedActions": [
    {
      "id": "log_template_route_playbook",
      "title": "Playbook für Routen- und Infrastrukturausfälle etablieren",
      "description": "Alternativrouten, Trigger, Carrier-Eskalation und Kundeninformation in einem abgestimmten Playbook abbilden.",
      "priority": "hoch",
      "ownerRole": "Disposition / Operations",
      "relatedQuestionIds": [
        "log_route_disruption",
        "supply_logistics_dependencies"
      ]
    },
    {
      "id": "log_template_hub_switch",
      "title": "Ausweichkonzept für kritische Hubs testen",
      "description": "Umschaltzeiten, Partnerdepots und Priorisierung kritischer Sendungen praktisch erproben.",
      "priority": "kritisch",
      "ownerRole": "Operations",
      "relatedQuestionIds": [
        "log_hub_redundancy",
        "log_customer_priority"
      ]
    }
  ],
  "evidenceTemplates": [
    {
      "id": "log_evidence_routes",
      "title": "Routenmatrix mit Alternativen und Eskalationsregeln",
      "type": "plan",
      "ownerRole": "Disposition",
      "reviewCycleHint": "Monatlich aktualisieren",
      "relatedQuestionIds": [
        "log_route_disruption"
      ]
    },
    {
      "id": "log_evidence_customer_priority",
      "title": "Freigegebene Priorisierungsliste für Kunden und Güter",
      "type": "policy",
      "ownerRole": "Vertrieb / Operations",
      "reviewCycleHint": "Bei Vertragsänderungen prüfen",
      "relatedQuestionIds": [
        "log_customer_priority"
      ]
    }
  ],
  "roleTemplates": [
    {
      "id": "log_role_dispatch",
      "label": "Disposition / Leitstelle",
      "responsibility": "Steuert kritische Touren, Priorisierung und Notfallkommunikation.",
      "approvalScope": "Disposition, Priorisierung und Umplanung",
      "focusAreas": [
        "Leitstelle",
        "Touren",
        "Kommunikation"
      ]
    },
    {
      "id": "log_role_fleet",
      "label": "Fuhrpark- und Ressourcensteuerung",
      "responsibility": "Sichert Fahrzeugverfügbarkeit, Fahrerreserven und Ausweichkapazitäten.",
      "approvalScope": "Flotteneinsatz und Notfallreserven",
      "focusAreas": [
        "Fuhrpark",
        "Fahrer",
        "Ersatzkapazität"
      ]
    },
    {
      "id": "log_role_site",
      "label": "Standort- und Lagerverantwortung",
      "responsibility": "Verantwortet Lagerbetrieb, Zutritt, Umschlag und Notbetrieb an kritischen Standorten.",
      "approvalScope": "Standortbetrieb und Lagernotfallverfahren",
      "focusAreas": [
        "Lager",
        "Standorte",
        "Zutritt"
      ]
    }
  ],
  "maturityProfile": {
    "targetOverall": 77,
    "targetByDomain": {
      "governance": 72,
      "operations": 82,
      "people": 74,
      "physical": 76,
      "cyber": 74,
      "supply": 82,
      "finance": 66,
      "bcm": 76
    },
    "notes": [
      "Für Logistik und Transport stehen Leitstellenfähigkeit, Standortrobustheit und Ersatzkapazitäten im Vordergrund."
    ]
  },
  "auditChecklist": [
    {
      "id": "log_audit_route_prioritization",
      "area": "Disposition",
      "title": "Priorisierung kritischer Touren und Kunden ist dokumentiert",
      "guidance": "Prüfen Sie Priorisierung, Eskalation, Leitstellenbesetzung und Kommunikationswege.",
      "severity": "high"
    },
    {
      "id": "log_audit_site_disruption",
      "area": "Standorte",
      "title": "Ausweichverfahren bei Ausfall eines Hubs oder Lagers sind belastbar",
      "guidance": "Berücksichtigen Sie Verlagerung, Schnittstellen, externe Partner und manuelle Verfahren.",
      "severity": "medium"
    }
  ]
}
